en_77.txt	BBC - Culture - What will films be like in 20 years?	http://www.bbc.com/culture/story/20190508-what-will-films-be-like-in-20-years	20190508	8 May 2019	Кино будущего: как будут смотреть фильмы через 20 лет	https://www.bbc.co.uk/russian/vert-cul-48511826	www.bbc.co.uk
en_78.txt	What life might be like in alien oceans - BBC Future	http://www.bbc.com/future/story/20190926-what-life-might-be-like-in-the-alien-oceans	20190926		Энцелад, Европа, Ганимед... Какую жизнь мы найдем в океанах других миров?	https://www.bbc.co.uk/russian/vert-fut-49921387	www.bbc.co.uk
en_79.txt	How your looks shape your personality - BBC Future	http://www.bbc.com/future/story/20190619-how-your-looks-shape-your-personality	20190619		Животные инстинкты: как наша внешность управляет нашей личностью	https://www.bbc.co.uk/russian/vert-fut-48760920	www.bbc.co.uk
en_80.txt	BBC - Travel - An exhilarating train journey across the Sahara	http://www.bbc.com/travel/story/20190904-an-exhilarating-train-journey-across-the-sahara	20190904	5 September 2019	“Поезд пустыни”: один из самых длинных и самых экстремальных в мире	https://www.bbc.co.uk/russian/vert-tra-49756160	www.bbc.co.uk
en_81.txt	The danger of overusing exclamation marks - BBC Worklife	http://www.bbc.com/capital/story/20190606-the-danger-of-overusing-exclamation-marks	20190606		Женщина и восклицательный знак: отношения, которые стоит пересмотреть	https://www.bbc.co.uk/russian/vert-cap-48676996	www.bbc.co.uk
en_82.txt	The curious origins of the dollar symbol - BBC Worklife	http://www.bbc.com/capital/story/20190528-the-curious-origin-of-the-symbol	20190528		Знак доллара как образ золотого тельца: кто его придумал?	https://www.bbc.co.uk/russian/vert-cap-48513025	www.bbc.co.uk
en_83.txt	Notes From Atlanta	https://www.farooqkperogi.com/	20190528		"Прощальные формулировки" в имейле - почему это важно?	https://www.bbc.co.uk/russian/vert-cap-48924975	www.bbc.co.uk
en_84.txt	The trick that makes you overspend - BBC Worklife	https://www.bbc.com/worklife/article/20190801-the-trick-that-makes-you-overspend	20190801		Уловки маркетологов: как нас разводят на более дорогие покупки и невыгодные решения	https://www.bbc.co.uk/russian/vert-cap-49294286	www.bbc.co.uk
en_85.txt	The jobs where liars excel - BBC Worklife	http://www.bbc.com/capital/story/20190625-the-jobs-where-liars-excel	20190625		Маленькая ежедневная ложь. Помогает ли она работе?	https://www.bbc.co.uk/russian/vert-cap-48842308	www.bbc.co.uk
en_86.txt	BBC - Culture - Why When Harry met Sally is the greatest romcom of all time	http://www.bbc.com/culture/story/20190705-why-when-harry-met-sally-is-the-greatest-romcom-of-all-time	20190705	12 July 2019	Почему “Когда Гарри встретил Салли” - лучшая романтическая комедия всех времен	https://www.bbc.co.uk/russian/vert-cul-49006186	www.bbc.co.uk
en_87.txt	The truth about saturated fat - BBC Future	http://www.bbc.com/future/story/20190712-saturated-fat-worse-than-unsaturated-fat	20190712		Насыщенные жиры - зло или норма? Кому верить?	https://www.bbc.co.uk/russian/vert-fut-49031741	www.bbc.co.uk
en_88.txt	No, you can't eat your way out of a hangover - BBC Future	http://www.bbc.com/future/story/20181224-no-you-cant-eat-your-way-out-of-a-hangover	20181224		Съесть что-нибудь, чтобы справиться с похмельем? Что именно?	https://www.bbc.co.uk/russian/vert-fut-47732939	www.bbc.co.uk
en_89.txt	Six myths (and truths) about hay fever - BBC Future	http://www.bbc.com/future/story/20190510-five-myths-and-truths-about-hayfever	20190510		Шесть мифов (а также вполне правдивых вещей) о сенной лихорадке	https://www.bbc.co.uk/russian/vert-fut-48422051	www.bbc.co.uk
en_90.txt	The rise of the sober bar - BBC Worklife	https://www.bbc.com/worklife/article/20190510-can-you-have-any-fun-at-a-bar-with-no-booze	20190510		Бар, где нет спиртного. Кто и зачем туда ходит?	https://www.bbc.co.uk/russian/vert-cap-49195042	www.bbc.co.uk
en_91.txt	What is the worst time of day to get sick? - BBC Future	http://www.bbc.com/future/story/20190904-is-there-a-worst-time-of-day-to-get-sick	20190904		В какое время суток лучше не лечиться. И не заболевать	https://www.bbc.co.uk/russian/vert-fut-49677624	www.bbc.co.uk
en_92.txt	Why are people thirsty for 'raw water'? - BBC Worklife	http://www.bbc.com/capital/story/20190620-why-are-people-thirsty-for-raw-water	20190620		“Сырая вода": что стоит за странным интересом к ней?	https://www.bbc.co.uk/russian/vert-cap-48925457	www.bbc.co.uk
en_93.txt	Does reading fiction make us better people? - BBC Future	http://www.bbc.com/future/story/20190523-does-reading-fiction-make-us-better-people	20190523		Больше читать? Но есть ли польза от выдуманных кем-то историй?	https://www.bbc.co.uk/russian/vert-fut-48708919	www.bbc.co.uk
en_94.txt	The problem with India’s man-eating tigers - BBC Future	https://www.bbc.com/future/article/20191120-the-problem-of-indias-man-eating-tigers	20191120		Вопрос, расколовший Индию: убивать ли тигров-людоедов?	https://www.bbc.co.uk/russian/vert-fut-50601180	www.bbc.co.uk
en_95.txt	Why can’t some people remember their dreams? - BBC Future	http://www.bbc.com/future/story/20190516-why-cant-some-people-remember-their-dreams	20190516		Вспомнить сон: почему это бывает так трудно?	https://www.bbc.co.uk/russian/vert-fut-48623054	www.bbc.co.uk
en_96.txt	BBC - Travel - Why the French love to say no	http://www.bbc.com/travel/story/20190804-why-the-french-love-to-say-no	20190804	5 August 2019	Почему французы отвечают “нет” на любой вопрос или просьбу	https://www.bbc.co.uk/russian/vert-tra-49265235	www.bbc.co.uk
en_97.txt	BBC - Travel - The truth about the US’ most iconic food	http://www.bbc.com/travel/story/20190702-the-truth-about-the-us-most-iconic-food	20190702	3 July 2019	Хот-дог: как немецкий и польский иммигранты сделали его любимой едой американцев	https://www.bbc.co.uk/russian/vert-tra-49005066	www.bbc.co.uk
en_98.txt	The ‘light triad’ that can make you a good person - BBC Future	http://www.bbc.com/future/story/20190617-the-light-triad-that-can-make-you-a-good-person	20190617		Светлая триада и "ежедневная святость" - что это и зачем это изучать?	https://www.bbc.co.uk/russian/vert-fut-48761065	www.bbc.co.uk
en_99.txt	A lottery win could change the way you vote - BBC Future	http://www.bbc.com/future/story/20181025-winning-money-changes-peoples-politics	20181025		Как крупный выигрыш в лотерею меняет политические взгляды	https://www.bbc.co.uk/russian/vert-fut-46140963	www.bbc.co.uk
en_100.txt	Why 'plant blindness' matters — and what you can do about it - BBC Future	http://www.bbc.com/future/story/20190425-plant-blindness-what-we-lose-with-nature-deficit-disorder	20190425		Эмоциональная связь с кустом? Я зову его Джон	https://www.bbc.co.uk/russian/vert-fut-48106677	www.bbc.co.uk
en_101.txt	Do mosquitoes feel the effects of alcohol? - BBC Future	http://www.bbc.com/future/story/20190313-will-mosquitoes-bite-me-more-when-ive-been-drinking	20190313		Нравится ли комарам кровь пьяного человека?	https://www.bbc.co.uk/russian/vert-fut-48107861	www.bbc.co.uk
en_102.txt	BBC - Travel - India’s city where people come to die	http://www.bbc.com/travel/story/20190617-indias-city-where-people-come-to-die	20190617	18 June 2019	Умереть в Варанаси: сюда приезжают ради выхода из круговорота страданий	https://www.bbc.co.uk/russian/vert-tra-48706515	www.bbc.co.uk
en_103.txt	The two illusions that tricked Arthur Conan Doyle - BBC Future	http://www.bbc.com/future/story/20190828-the-two-bizarre-hoaxes-that-tricked-arthur-conan-doyle	20190828		Конан Дойл и потустороннее: чем объяснить странные взгляды знаменитого писателя	https://www.bbc.co.uk/russian/vert-fut-49596260	www.bbc.co.uk
en_104.txt	Is it right to use Nazi research if it can save lives? - BBC Future	http://www.bbc.com/future/story/20190723-the-ethics-of-using-nazi-science	20190723		Этично ли пользоваться данными научных экспериментов нацистов?	https://www.bbc.co.uk/russian/vert-fut-49110447	www.bbc.co.uk
en_105.txt	Why the Swiss still love cash - BBC Worklife	http://www.bbc.com/capital/story/20190416-why-the-swiss-still-love-cash	20190416		Почему швейцарцы так любят наличные (желательно крупными купюрами)	https://www.bbc.co.uk/russian/vert-cap-48040951	www.bbc.co.uk
en_106.txt	The fatalistic phrase that every culture has - BBC Worklife	http://www.bbc.com/capital/story/20190418-the-fatalistic-phrase-that-every-culture-has	20190418		Безнадёга и сё га най. Почему выражения, полные фатализма, есть в каждом языке	https://www.bbc.co.uk/russian/vert-cap-48039601	www.bbc.co.uk
en_107.txt	The '3.5% rule': How a small minority can change the world - BBC Future	http://www.bbc.com/future/story/20190513-it-only-takes-35-of-people-to-change-the-world	20190513		"Правило 3,5%": как незначительное меньшинство может без насилия изменить мир	https://www.bbc.co.uk/russian/vert-fut-49292561	www.bbc.co.uk
en_108.txt	The transformational power of how you talk about your life - BBC Future	http://www.bbc.com/future/story/20190523-the-way-you-tell-your-life-story-shapes-your-personality	20190523		Хотите изменить свою жизнь к лучшему? Начните рассказывать о ней по-другому	https://www.bbc.co.uk/russian/vert-fut-48882166	www.bbc.co.uk
en_109.txt	BBC - Travel - Fidel Castro’s secret love affair with NYC	http://www.bbc.com/travel/story/20190924-fidel-castros-secret-love-affair-with-nyc	20190924	26 September 2019	Фидель Кастро и его тайная влюбленность в Нью-Йорк	https://www.bbc.co.uk/russian/vert-tra-49921239	www.bbc.co.uk
en_110.txt	The science behind why some of us are shy - BBC Future	http://www.bbc.com/future/story/20190604-the-science-behind-why-some-of-us-are-shy	20190604		Стеснительность - это нормально? Или надо лечить?	https://www.bbc.co.uk/russian/vert-fut-48596161	www.bbc.co.uk
en_111.txt	Why the world now has more grandparents than grandchildren - BBC Worklife	http://www.bbc.com/capital/story/20190405-why-the-world-now-has-more-grandparents-than-grandchildren	20190405		Стариков больше, чем детей. Куда катится наша планета?	https://www.bbc.co.uk/russian/vert-cap-47977944	www.bbc.co.uk
en_112.txt	The one writing skill you must master - BBC Worklife	http://www.bbc.com/capital/story/20181017-the-goal-towards-which-your-words-adamantly-move	20181017		Важное умение поставить точку - нет, не в отношениях	https://www.bbc.co.uk/russian/vert-cap-45994936	www.bbc.co.uk
en_113.txt	The bizarre bias that affects how you shop - BBC Future	http://www.bbc.com/future/story/20181115-anti-fat-bias-round-shapes-are-sold-to-overweight-customers	20181115		Как предвзятое отношение продавцов влияет на ваши покупки	https://www.bbc.co.uk/russian/vert-fut-46457774	www.bbc.co.uk
en_114.txt	BBC - Travel - The cat who saved a Japanese rail line	http://www.bbc.com/travel/story/20190522-the-cat-who-saved-a-japanese-rail-line	20190522	22 May 2019	Кошка-самурай, которая спасла японскую железную дорогу	https://www.bbc.co.uk/russian/vert-tra-48474618	www.bbc.co.uk
en_115.txt	Five ways you could become a memory champion - BBC Future	http://www.bbc.com/future/story/20190329-five-ways-you-could-become-a-memory-champion	20190329		Как стать чемпионом по запоминанию: пять способов	https://www.bbc.co.uk/russian/vert-fut-47813670	www.bbc.co.uk
en_116.txt	Homepage | Penguin and Pia	https://www.penguinandpia.com/en/	20190329		Пять стран, где цифровое будущее уже наступило. Как там живется?	https://www.bbc.co.uk/russian/vert-tra-48842971	www.bbc.co.uk
en_117.txt	Why more men than women die by suicide - BBC Future	http://www.bbc.com/future/story/20190313-why-more-men-kill-themselves-than-women	20190313		Мужской суицид: чем он отличается от женского и почему случается чаще	https://www.bbc.co.uk/russian/vert-fut-48596494	www.bbc.co.uk
en_118.txt	The power of our hidden senses - BBC Future	http://www.bbc.com/future/story/20190314-the-power-of-hidden-senses-like-echolocation	20190314		Каждый из нас немного дельфин. Или летучая мышь	https://www.bbc.co.uk/russian/vert-fut-47653377	www.bbc.co.uk
en_119.txt	Why we need to talk about cheating - BBC Future	http://www.bbc.com/future/story/20190625-why-we-need-to-talk-about-cheating	20190625		Неверность: почему нам не стоит быть слишком доверчивыми	https://www.bbc.co.uk/russian/vert-fut-48788426	www.bbc.co.uk
en_120.txt	BBC - Culture - Is it the end for high heels?	http://www.bbc.com/culture/story/20190509-is-it-the-end-for-high-heels	20190509	15 May 2019	Шпильки против кроссовок: откажется ли высокая мода от высокого каблука?	https://www.bbc.co.uk/russian/vert-cul-48555990	www.bbc.co.uk
en_121.txt	How many days should you take off work? - BBC Worklife	http://www.bbc.com/capital/story/20190404-how-to-calculate-your-perfect-holiday-length	20190404		"Точка счастья": как сделать так, чтобы не заскучать в середине отпуска	https://www.bbc.co.uk/russian/vert-cap-47952044	www.bbc.co.uk
en_122.txt	Genes shown to influence how well children do throughout their time at school	https://theconversation.com/genes-shown-to-influence-how-well-children-do-throughout-their-time-at-school-102520	20190404		На успеваемость вашего ребенка влияют в первую очередь гены, а не интеллект	https://www.bbc.co.uk/russian/vert-fut-45682136	www.bbc.co.uk
en_123.txt	Sunscreen: What science says about ingredient safety - BBC Future	http://www.bbc.com/future/story/20190722-sunscreen-safe-or-toxic	20190722		Солнцезащитный крем: насколько безопасны его ингредиенты?	https://www.bbc.co.uk/russian/vert-fut-49127355	www.bbc.co.uk
en_124.txt	BBC - Culture - Is it the end for the man’s suit?	http://www.bbc.com/culture/story/20190307-is-it-the-end-for-the-mans-suit	20190307	8 March 2019	Неужели это начало конца классического мужского костюма?	https://www.bbc.co.uk/russian/vert-cul-47882223	www.bbc.co.uk
en_125.txt	Why you shouldn't trust your food cravings - BBC Future	http://www.bbc.com/future/story/20190524-food-cravings-are-they-a-sign-of-nutritional-deficit	20190524		Почему не стоит доверять острому желанию что-то съесть	https://www.bbc.co.uk/russian/vert-fut-48446539	www.bbc.co.uk
en_126.txt	Would you want to stay in a space hotel? - BBC Future	http://www.bbc.com/future/story/20190306-would-you-want-to-stay-in-a-space-hotel	20190306		Aurora Station, космический отель на орбите: когда и почем?	https://www.bbc.co.uk/russian/vert-fut-47653370	www.bbc.co.uk
en_127.txt	The cities that need a warning label? - BBC Future	http://www.bbc.com/future/story/20190408-paris-syndrome-when-travel-sparks-a-psychotic-state	20190408		Города, которые сводят с ума. В буквальном смысле	https://www.bbc.co.uk/russian/vert-fut-47951265	www.bbc.co.uk
en_128.txt	BBC - Travel - China’s spectacular mountains encased in ice	http://www.bbc.com/travel/story/20180201-chinas-spectacular-mountains-encased-in-ice	20180201	2 February 2018	Китай: потрясающие виды гор, закованных в ледяной панцирь	http://www.bbc.co.uk/russian/vert-tra-42961065	www.bbc.co.uk
en_129.txt	BBC - Culture - Striking photos of human scars on Earth	http://www.bbc.com/culture/story/20181017-striking-photos-of-human-scars-on-earth	20181017	17 October 2018	Фото: страшные шрамы на теле Земли - дело рук человека	https://www.bbc.co.uk/russian/vert-cul-46457781	www.bbc.co.uk
en_130.txt	Can decluttering your house really make you happier? - BBC Future	http://www.bbc.com/future/story/20190515-can-decluttering-your-house-really-spark-joy	20190515		Прибранная жизнь. Делает ли нас счастливее наведение порядка в доме?	https://www.bbc.co.uk/russian/vert-fut-48445724	www.bbc.co.uk
en_131.txt	BBC - Travel - France’s fascinating ‘wine treatment’	http://www.bbc.com/travel/story/20190501-frances-fascinating-wine-treatment	20190501	2 May 2019	Эльзасское лекарство: здесь почти всё лечили вином. Французским	https://www.bbc.co.uk/russian/vert-tra-48187705	www.bbc.co.uk
en_132.txt	Which country has the most expensive education? - BBC Future	http://www.bbc.com/future/story/20180829-where-is-the-most-expensive-country-to-go-to-school	20180829		Что, учиться 23 года?! И сколько же это стоит?	https://www.bbc.co.uk/russian/vert-fut-45410241	www.bbc.co.uk
en_133.txt	What would you really like to say with your 'out-of-office'? - BBC Worklife	http://www.bbc.com/capital/story/20190331-what-would-you-really-like-to-say-with-your-out-of-office	20190331		Как лучше сформулировать автоматический ответ об отсутствии в офисе	https://www.bbc.co.uk/russian/vert-cap-47816846	www.bbc.co.uk
en_134.txt	"Scarface": orgías, fiestas y cocaína en el hotel de Miami que inspiró la famosa película - BBC News Mundo	https://www.bbc.com/mundo/noticias-46789423	20190331		Оргии, вечеринки и кокаин в Майами: какой была жизнь знаменитого отеля из фильма "Лицо со шрамом"	https://www.bbc.co.uk/russian/features-46825281	www.bbc.co.uk
en_135.txt	A 'samurai' swordsmith is designing a space probe - BBC Future	http://www.bbc.com/future/story/20181113-a-samurai-swordsmith-is-designing-a-space-probe	20181113		Чем может помочь в космосе самурайский меч	https://www.bbc.co.uk/russian/vert-fut-46288654	www.bbc.co.uk
en_136.txt	How a daily 10-minute exercise could boost your happiness - BBC Future	http://www.bbc.com/future/story/20181016-how-to-boost-your-mood-with-one-10-minute-exercise	20181016		Как сделать себя счастливее за 10 минут. Шесть простых шагов	https://www.bbc.co.uk/russian/vert-fut-45965465	www.bbc.co.uk
en_137.txt	Should prostitution be a normal profession? - BBC Worklife	http://www.bbc.com/capital/story/20190419-should-prostitution-be-a-normal-profession	20190419		Пора ли считать проституцию обычной профессией?	https://www.bbc.co.uk/russian/vert-cap-48039013	www.bbc.co.uk
en_138.txt	The unexpected magic of mushrooms - BBC Future	http://www.bbc.com/future/story/20190314-the-unexpected-magic-of-mushrooms	20190314		Как волшебные свойства грибов могут спасти человечество	https://www.bbc.co.uk/russian/vert-fut-47693735	www.bbc.co.uk
en_139.txt	BBC Radio 4 - Seriously…, PowerPointless	https://www.bbc.co.uk/programmes/p05g2msc	20190314		Программа презентаций Microsoft PowerPoint: от любви до ненависти	https://www.bbc.co.uk/russian/vert-cap-49163295	www.bbc.co.uk
en_140.txt	How to build a better train toilet - BBC Future	http://www.bbc.com/future/story/20181008-how-to-build-a-better-train-toilet	20181008		Как сделать туалеты в поездах не такими ужасными	https://www.bbc.co.uk/russian/vert-fut-45902662	www.bbc.co.uk
en_141.txt	What's driving the rise of the McVegan burger? - BBC Worklife	http://www.bbc.com/capital/story/20180907-whats-driving-the-unstoppable-rise-of-the-mcvegan-burger	20180907		Кому понадобился бургер без мяса и кто будет его есть	https://www.bbc.co.uk/russian/vert-cap-45475056	www.bbc.co.uk
en_142.txt	Five memory hacks to make you smarter - BBC Future	http://www.bbc.com/future/story/20180904-five-memory-hacks-to-make-you-smarter	20180904		Сессия близко? Вот пять лайфхаков, которые помогут вам лучше запомнить материал	https://www.bbc.co.uk/russian/vert-fut-46470028	www.bbc.co.uk
en_143.txt	Can technology help you lose an accent? - BBC Worklife	http://www.bbc.com/capital/story/20190506-this-technology-could-help-you-lose-your-accent	20190506		У вас есть акцент в иностранном языке. Как от него избавиться?	https://www.bbc.co.uk/russian/vert-cap-48556193	www.bbc.co.uk
en_144.txt	The violent attack that turned a man into a maths genius - BBC Future	http://www.bbc.com/future/story/20190411-the-violent-attack-that-turned-a-man-into-a-maths-genius	20190411		Как удар по голове превратил продавца диванов в гения	https://www.bbc.co.uk/russian/vert-fut-48040160	www.bbc.co.uk
en_145.txt	The best time of year to make a life decision? - BBC Future	http://www.bbc.com/future/story/20181126-the-best-time-of-year-to-make-a-life-decision	20181126		Самое лучшее время года для принятия жизненно важных решений?	https://www.bbc.co.uk/russian/vert-fut-46538314	www.bbc.co.uk
en_146.txt	Is it better to be like your partner? - BBC Future	http://www.bbc.com/future/story/20181011-are-relationships-better-if-partners-are-more-similar	20181011		"Мы так похожи, дорогой. Почему же нам плохо вместе?"	https://www.bbc.co.uk/russian/vert-fut-45977330	www.bbc.co.uk
en_147.txt	Why emoji mean different things in different cultures - BBC Future	http://www.bbc.com/future/story/20181211-why-emoji-mean-different-things-in-different-cultures	20181211		Опасные эмодзи: кое-где они означают совсем не то, что вы думаете	https://www.bbc.co.uk/russian/vert-fut-46623432	www.bbc.co.uk
en_148.txt	The dark side of believing in true love - BBC Future	http://www.bbc.com/future/story/20190211-the-dark-side-of-believing-in-true-love	20190211		Чем опасна вера в настоящую и единственную любовь	https://www.bbc.co.uk/russian/vert-fut-47732933	www.bbc.co.uk
en_149.txt	The rocket tower being built in tropical jungle - BBC Future	http://www.bbc.com/future/story/20181206-the-rocket-tower-being-built-in-tropical-jungle	20181206		Как посреди тропических джунглей строят пусковую площадку для "Ариан-6"	https://www.bbc.co.uk/russian/vert-fut-46484287	www.bbc.co.uk
en_150.txt	The real reasons why sharks attack humans - BBC Future	http://www.bbc.com/future/story/20190808-why-do-sharks-attack-humans	20190808		Челюсти-2019: почему акулы на самом деле нападают на людей?	https://www.bbc.co.uk/russian/vert-fut-49361497	www.bbc.co.uk
en_151.txt	Is juicing actually good for you? - BBC Future	http://www.bbc.com/future/story/20181231-is-juicing-actually-good-for-you	20181231		Так ли полезны свежевыжатые соки? И выводят ли они токсины?	https://www.bbc.co.uk/russian/vert-fut-47640206	www.bbc.co.uk
en_152.txt	Does an extra hour of sleep matter? - BBC Worklife	http://www.bbc.com/capital/story/20190104-does-an-extra-hour-of-sleep-matter	20190104		Что нам даст один дополнительный час сна	https://www.bbc.co.uk/russian/vert-cap-47641211	www.bbc.co.uk
en_153.txt	How much water should you drink a day? - BBC Future	http://www.bbc.com/future/story/20190403-how-much-water-should-you-drink-a-day	20190403		Так сколько же воды надо выпивать ежедневно? И зачем?	https://www.bbc.co.uk/russian/vert-fut-47880538	www.bbc.co.uk
