en_154.txt	What if California seceded from the US? - BBC Future	http://www.bbc.com/future/story/20190221-what-if-california-seceded-from-the-us	20190221		Что случится, если штат Калифорния выйдет из состава США?	https://www.bbc.co.uk/russian/vert-fut-47881205	www.bbc.co.uk
en_155.txt	Five myths about wildfires - BBC Future	http://www.bbc.com/future/story/20181113-five-myths-about-wildfires	20181113		Этот огонь с нами надолго: пять мифов о лесных пожарах	https://www.bbc.co.uk/russian/vert-fut-46224026	www.bbc.co.uk
en_156.txt	What single word defines who you are? - BBC Future	http://www.bbc.com/future/story/20181120-what-single-word-defines-who-you-are	20181120		Минимальный тест Тьюринга: докажи одним словом, что ты - человек	https://www.bbc.co.uk/russian/vert-fut-46400107	www.bbc.co.uk
en_157.txt	Could you have this memory disorder? - BBC Future	http://www.bbc.com/future/story/20181112-severely-deficient-autobiographical-memory-is-surprisi	20181112		Люди, которые не помнят своего прошлого - стоит ли их жалеть?	https://www.bbc.co.uk/russian/vert-fut-46235138	www.bbc.co.uk
en_158.txt	The 'unwarranted hype' of stem cell therapies - BBC Future	http://www.bbc.com/future/story/20190819-the-unwarranted-hype-of-stem-cell-therapies-for-autism-ms	20190819		Лечение стволовыми клетками: дороговизна, ажиотаж и ложные надежды?	https://www.bbc.co.uk/russian/vert-fut-49525732	www.bbc.co.uk
en_159.txt	How cheating can help you reach your goals - BBC Worklife	http://www.bbc.com/capital/story/20180216-yes-cheat-a-tiny-bit-on-those-goals	20180216		Как маленькая хитрость помогает достичь больших целей	http://www.bbc.co.uk/russian/vert-cap-43372459	www.bbc.co.uk
en_160.txt	Why there’s so little left of the early internet - BBC Future	http://www.bbc.com/future/story/20190401-why-theres-so-little-left-of-the-early-internet	20190401		Почему во Всемирной сети осталось так немного от ее ранних лет	https://www.bbc.co.uk/russian/vert-fut-47815742	www.bbc.co.uk
en_161.txt	Why you don’t really have a ‘type’ - BBC Future	http://www.bbc.com/future/story/20180918-online-dating-is-changing-our-perceptions-of-beauty	20180918		Вам нравятся бородатые мужчины? Это быстро пройдет, и вот почему	https://www.bbc.co.uk/russian/vert-fut-45763075	www.bbc.co.uk
en_162.txt	The 'super suit' that helps people move - BBC Future	http://www.bbc.com/future/story/20180705-the-super-suit-that-can-help-people-walk	20180705		Это то, что нам всем может понадобиться: электрические мышцы	http://www.bbc.co.uk/russian/vert-fut-44770312	www.bbc.co.uk
en_163.txt	BBC - Travel - The German city beloved by Chinese	http://www.bbc.com/travel/story/20180725-the-german-city-beloved-by-chinese	20180725	26 July 2018	Как немецкий Трир зарабатывает на любви китайцев к Карлу Марксу	https://www.bbc.co.uk/russian/vert-tra-45085944	www.bbc.co.uk
en_164.txt	Has humanity reached ‘peak intelligence’? - BBC Future	http://www.bbc.com/future/story/20190709-has-humanity-reached-peak-intelligence	20190709		Достигло ли человечество пика интеллекта, и что будет дальше	https://www.bbc.co.uk/russian/vert-fut-48954200	www.bbc.co.uk
en_165.txt	Six reasons your memory is stranger than you think - BBC Future	http://www.bbc.com/future/story/20181205-six-reasons-your-memory-is-stranger-than-you-think	20181205		Шесть странностей нашей памяти: все еще удивительнее, чем вы думали	https://www.bbc.co.uk/russian/vert-fut-46538990	www.bbc.co.uk
en_166.txt	Would you use a self-rocking cradle for your baby? - BBC Future	http://www.bbc.com/future/story/20180921-the-robotic-hand-that-rocks-the-cradle	20180921		Готовы ли вы доверить своего младенца колыбели-роботу?	https://www.bbc.co.uk/russian/vert-fut-45670292	www.bbc.co.uk
en_167.txt	Five myths about broken bones - BBC Future	http://www.bbc.com/future/story/20181005-five-myths-about-broken-bones	20181005		Пять мифов о переломах: чего действительно стоит опасаться	https://www.bbc.co.uk/russian/vert-fut-45876314	www.bbc.co.uk
en_168.txt	BBC - Travel - The magnificent palaces of Poland’s Lower Silesia	http://www.bbc.com/travel/story/20180221-the-magnificent-palaces-of-polands-lower-silesia	20180221	22 February 2018	Любите замки? Тогда Нижняя Силезия вас приятно удивит	http://www.bbc.co.uk/russian/vert-tra-43371281	www.bbc.co.uk
en_169.txt	The truth about family estrangement - BBC Future	http://www.bbc.com/future/story/20190328-family-estrangement-causes	20190328		Разрыв отношений с близкими: заблуждения, причины и возможные плюсы	https://www.bbc.co.uk/russian/vert-fut-47813676	www.bbc.co.uk
en_170.txt	Sitzfleisch: The German concept to get more work done - BBC Worklife	http://www.bbc.com/capital/story/20180903-to-have-sitzfleisch---its-a-professional-compliment	20180903		"Сидеть на мясе" по-немецки: почему это качество полезно каждому	https://www.bbc.co.uk/russian/vert-cap-45422645	www.bbc.co.uk
en_171.txt	The deepest hole we have ever dug - BBC Future	http://www.bbc.com/future/story/20190503-the-deepest-hole-we-have-ever-dug	20190503		Насколько глубоки могут быть сверхглубокие скважины и что искали внутри Земли СССР и США?	https://www.bbc.co.uk/russian/vert-fut-48188978	www.bbc.co.uk
en_172.txt	BBC - Culture - Striking photos of stunning buildings	http://www.bbc.com/culture/story/20171017-the-best-architecture-images-of-the-year	20171017	17 October 2017	10 архитектурных фотографий удивительной красоты	http://www.bbc.co.uk/russian/vert-cul-41683001	www.bbc.co.uk
en_173.txt	BBC - Culture - Ribera: Was this the vision of a sadist?	http://www.bbc.com/culture/story/20181003-ribera-was-this-the-vision-of-a-sadist	20181003	3 October 2018	Хосе де Рибера: был ли знаменитый художник садистом? Судите сами	https://www.bbc.co.uk/russian/vert-cul-45878393	www.bbc.co.uk
en_174.txt	Why catastrophes can change the course of humanity - BBC Future	http://www.bbc.com/future/story/20190408-how-catastrophes-can-change-the-path-of-humanity	20190408		Почему глобальные катастрофы не ходят поодиночке и чем это грозит человечеству	https://www.bbc.co.uk/russian/vert-fut-47977951	www.bbc.co.uk
en_175.txt	Cold remedies: Old wives' tales... or legitimate science? - BBC Future	http://www.bbc.com/future/story/20181203-do-cold-remedies-like-chicken-soup-and-vitamin-c-really-work	20181203		Можно ли вылечить простуду по бабушкиным рецептам?	https://www.bbc.co.uk/russian/vert-fut-46540915	www.bbc.co.uk
en_176.txt	When a pet dies, should you be allowed time off work? - BBC Worklife	http://www.bbc.com/capital/story/20180912-when-a-pet-dies-should-you-be-allowed-time-off-work	20180912		Заявление на отпуск в связи с утратой близкого… котика?	https://www.bbc.co.uk/russian/vert-cap-45761082	www.bbc.co.uk
en_177.txt	The unusual reason Chinese tourists are going to S Korea - BBC Worklife	http://www.bbc.com/capital/story/20181001-spending-your-holiday-driving-round-in-circles	20181001		Зачем ехать в Южную Корею, чтобы сдать на права	https://www.bbc.co.uk/russian/vert-cap-45761076	www.bbc.co.uk
en_178.txt	The surprising truth about loneliness - BBC Future	http://www.bbc.com/future/story/20180928-the-surprising-truth-about-loneliness	20180928		Эксперимент Би-би-си: вся правда об одиночестве	https://www.bbc.co.uk/russian/vert-fut-45748133	www.bbc.co.uk
en_179.txt	BBC - Culture - What makes Federico Fellini ‘the maestro’ of Italian cinema?	http://www.bbc.com/culture/story/20181030-what-makes-federico-fellini-the-maestro-of-italian-cinema	20181030	12 November 2018	Чем так хорош Федерико Феллини и почему его считают гением итальянского кино	https://www.bbc.co.uk/russian/vert-cul-46194369	www.bbc.co.uk
en_180.txt	BBC - Travel - Catalonia’s beloved scatological Christmas custom	http://www.bbc.com/travel/story/20181216-spains-beloved-scatological-christmas-custom	20181216	17 December 2018	Не совсем пристойные рождественские традиции каталонцев	https://www.bbc.co.uk/russian/vert-tra-46634768	www.bbc.co.uk
en_181.txt	How do you decaffeinate coffee? - BBC Future	http://www.bbc.com/future/story/20180917-how-do-you-decaffeinate-coffee	20180917		Лишить кофе кофеина не так просто даже в XXI веке	https://www.bbc.co.uk/russian/vert-fut-45670819	www.bbc.co.uk
en_182.txt	BBC - Travel - The last true knight on Malta	http://www.bbc.com/travel/story/20181129-the-last-true-knight-on-malta	20181129	30 November 2018	В гостях у последнего настоящего рыцаря острова Мальта	https://www.bbc.co.uk/russian/vert-tra-46470036	www.bbc.co.uk
en_183.txt	Are people misinterpreting your email sign-off? - BBC Worklife	http://www.bbc.com/capital/story/20180413-best-wishes-kind-regards-or-an-icy-yrs	20180413		Что думают другие о вашей манере подписывать имейлы?	http://www.bbc.co.uk/russian/vert-cap-43811226	www.bbc.co.uk
en_184.txt	Driving one of the world's largest vehicles - BBC Future	http://www.bbc.com/future/story/20180719-what-its-like-to-drive-nasas-giant-rocket-mover	20180719		"Она у нас одна": как повезут к старту гигантскую ракету НАСА	http://www.bbc.co.uk/russian/vert-fut-44928492	www.bbc.co.uk
en_185.txt	What if we knew when people were lying? - BBC Future	http://www.bbc.com/future/story/20190324-what-if-we-knew-when-people-were-lying	20190324		Мир, в котором невозможно лгать - это хорошо или плохо?	https://www.bbc.co.uk/russian/vert-fut-47734695	www.bbc.co.uk
en_186.txt	BBC - Culture - Film review: Bohemian Rhapsody	http://www.bbc.com/culture/story/20181024-film-review-bohemian-rhapsody	20181024	24 October 2018	"Богемская рапсодия": бюджетное семейное кино о Фредди Меркьюри?	https://www.bbc.co.uk/russian/vert-cul-46030952	www.bbc.co.uk
en_187.txt	The surprising source of the Tokyo 2020 Olympic medals - BBC Future	http://www.bbc.com/future/story/20181120-the-surprising-source-of-the-tokyo-2020-olympic-medals	20181120		Алхимия по-японски и золото из электронного мусора	https://www.bbc.co.uk/russian/vert-fut-46456874	www.bbc.co.uk
en_188.txt	BBC - Culture - Is this the end for real fur?	http://www.bbc.com/culture/story/20181004-how-fashion-fell-in-love-with-faux-fur	20181004	11 October 2018	Мода отвергает натуральный мех. Но его могущественное лобби не сдается	https://www.bbc.co.uk/russian/vert-cul-45902654	www.bbc.co.uk
en_189.txt	The reasons why women’s voices are deeper today - BBC Worklife	http://www.bbc.com/capital/story/20180612-the-reasons-why-womens-voices-are-deeper-today	20180612		Голоса женщин стали ниже. В чем причина?	http://www.bbc.co.uk/russian/vert-cap-44469125	www.bbc.co.uk
en_190.txt	The surprising origins of the TV remote - BBC Future	http://www.bbc.com/future/story/20180830-the-history-of-the-television-remote-contro	20180830		Это устройство изменило то, как мы смотрим телевизор. Сочтены ли дни пульта ДУ?	https://www.bbc.co.uk/russian/vert-fut-45399894	www.bbc.co.uk
en_191.txt	The 10 personality traits that English cannot name - BBC Future	http://www.bbc.com/future/story/20181030-the-10-personality-traits-that-english-cant-name	20181030		10 черт характера, для которых нет английского слова (но есть русское)	https://www.bbc.co.uk/russian/vert-fut-46289145	www.bbc.co.uk
en_192.txt	Why gene editing could create so many jobs - BBC Worklife	http://www.bbc.com/capital/story/20181003-why-gene-therapy-will-create-so-many-jobs	20181003		Хотите гарантированно много зарабатывать? Учитесь на генного инженера	https://www.bbc.co.uk/russian/vert-cap-46289151	www.bbc.co.uk
en_193.txt	Homes made of concrete tubes could solve the housing crisis - BBC Worklife	http://www.bbc.com/capital/story/20180301-homes-made-of-concrete-tubes-could-solve-the-housing-crisis	20180301		Решение проблемы дефицита жилья – жизнь в трубе?	http://www.bbc.co.uk/russian/vert-cap-43473887	www.bbc.co.uk
en_194.txt	BBC - Travel - Užupis: A tiny republic of free spirits	http://www.bbc.com/travel/story/20181014-uupis-a-tiny-republic-of-free-spirits	20181014	15 October 2018	Вольная республика Ужупис: каждый имеет право на горячую воду	https://www.bbc.co.uk/russian/vert-tra-45914611	www.bbc.co.uk
en_195.txt	What is the best age to learn a language? - BBC Future	http://www.bbc.com/future/story/20181024-the-best-age-to-learn-a-foreign-language	20181024		Правда ли, что иностранный язык лучше всего учить в детстве?	https://www.bbc.co.uk/russian/vert-fut-46030959	www.bbc.co.uk
en_196.txt	BBC - Earth - How quickly can you spot these camouflaged animals?	http://www.bbc.com/earth/story/20160812-are-these-the-best-camouflaged-animals	20160812	14 August 2016	Как быстро вы сможете обнаружить спрятавшихся животных?	http://www.bbc.co.uk/russian/vert-earth-37187512	www.bbc.co.uk
en_197.txt	Why young Germans are feeling gloomy about their country - BBC Worklife	http://www.bbc.com/capital/story/20180926-why-young-germans-are-feeling-gloomy-about-their-country	20180926		Молодым немцам не нравится, куда идет их страна. Что не так с Германией?	https://www.bbc.co.uk/russian/vert-cap-45745258	www.bbc.co.uk
en_199.txt	BBC - Travel - Why Brazilians are always late	http://www.bbc.com/travel/story/20180729-why-brazilians-are-always-late	20180729	30 July 2018	Почему бразильцы всегда опаздывают и считают это правильным	https://www.bbc.co.uk/russian/vert-tra-45010327	www.bbc.co.uk
en_200.txt	BBC - Travel - Cracking India’s mystifying ‘nod code’	http://www.bbc.com/travel/story/20180722-cracking-indias-mystifying-nod-code	20180722	23 July 2018	Кивок по-индийски – как разгадать его значение и смысл?	http://www.bbc.co.uk/russian/vert-tra-44955830	www.bbc.co.uk
en_201.txt	Why Europe’s astronauts are learning Chinese - BBC Future	http://www.bbc.com/future/story/20180626-why-europes-astronauts-are-learning-chinese	20180626		Зачем европейские астронавты учат китайский язык	http://www.bbc.co.uk/russian/vert-fut-44631111	www.bbc.co.uk
en_202.txt	BBC - Travel - Lithuania’s miraculous hill of 100,000 crosses	http://www.bbc.com/travel/story/20171026-lithuanias-miraculous-hill-of-100000-crosses	20171026	28 October 2017	Литва: какие тайны хранит чудесный холм ста тысяч крестов	http://www.bbc.co.uk/russian/vert-tra-41844545	www.bbc.co.uk
en_203.txt	How the office Christmas party is different this year - BBC Worklife	http://www.bbc.com/capital/story/20171213-how-the-office-christmas-party-is-different-this-year	20171213		Как последние секс-скандалы повлияют на новогодние корпоративы	http://www.bbc.co.uk/russian/vert-cap-42438945	www.bbc.co.uk
en_204.txt	BBC - Culture - The designers made by Instagram	http://www.bbc.com/culture/story/20180124-the-designers-made-by-instagram	20180124	25 January 2018	Дизайнерские аккаунты в "Инстаграме": бесплатно и интересно	http://www.bbc.co.uk/russian/vert-cul-42873174	www.bbc.co.uk
en_205.txt	Three lessons about Earth from astronauts - BBC Future	http://www.bbc.com/future/story/20171129-three-lessons-about-earth-from-astronauts	20171129		Уроки космоса: три важные вещи, которые открылись астронавтам	http://www.bbc.co.uk/russian/vert-fut-42352917	www.bbc.co.uk
en_206.txt	How cured meats protect us from food poisoning - BBC Future	http://www.bbc.com/future/story/20180406-how-cured-meats-protect-us-from-food-poisoning	20180406		Вяленое мясо: почему мы до сих пор им не отравились	https://www.bbc.co.uk/russian/vert-fut-43742749	www.bbc.co.uk
en_207.txt	Cave rescue: The dangerous diseases lurking underground - BBC Future	http://www.bbc.com/future/story/20180710-thai-cave-the-dangerous-diseases-you-can-catch-in-caves	20180710		Смертельные инфекции, поджидающие нас в пещерах	http://www.bbc.co.uk/russian/vert-fut-44811524	www.bbc.co.uk
en_208.txt	Spice: Why some of us like it hot - BBC Future	http://www.bbc.com/future/story/20180216-spice-why-some-of-us-are-hardwired-to-like-it-hot	20180216		Наслаждение и страдание: почему некоторые любят поострее	http://www.bbc.co.uk/russian/vert-fut-43142936	www.bbc.co.uk
en_209.txt	What call centres can tell us about sexism - BBC Worklife	http://www.bbc.com/capital/story/20180208-the-female-ghetto-of-workplaces	20180208		Почему колл-центры превратились в женские гетто	http://www.bbc.co.uk/russian/vert-cap-43144101	www.bbc.co.uk
en_210.txt	Thai cave: How life in darkness could affect trapped boys - BBC Future	http://www.bbc.com/future/story/20180704-thai-cave-how-life-in-darkness-could-affect-trapped-boys	20180704		В пещерах Таиланда: что сделает с детьми жизнь в темноте?	http://www.bbc.co.uk/russian/vert-fut-44714094	www.bbc.co.uk
en_211.txt	BBC - Earth - One man has spent 15 years photographing snowflakes	http://www.bbc.com/earth/story/20151212-the-beauty-of-ice-crystals	20151212	12 December 2015	Неповторимые и чудесные: геометрия снежинок в фотографиях	http://www.bbc.com/russian/science/2016/01/151230_vert_ear_beauty_of_ice_crystals	www.bbc.com
en_212.txt	When the going gets tough, have a nap - BBC Future	http://www.bbc.com/future/story/20181009-how-sleep-helps-with-emotional-recovery-and-trauma	20181009		Лучший рецепт для разбитого сердца или помраченного ума - лечь вздремнуть	https://www.bbc.co.uk/russian/vert-fut-45978603	www.bbc.co.uk
en_213.txt	BBC - Travel - ‘Cwtch’: The hug invented by the Welsh	http://www.bbc.com/travel/story/20180624-cwtch-the-hug-invented-by-the-welsh	20180624	25 June 2018	Главное, что нам нужно в этом неуютном мире, это cwtch	http://www.bbc.co.uk/russian/vert-tra-44604210	www.bbc.co.uk
en_214.txt	Do you inherit the ability to roll your tongue? - BBC Future	http://www.bbc.com/future/story/20180130-do-you-inherit-the-ability-to-roll-your-tongue	20180130		Медицинские мифы: умение сворачивать язык в трубочку - это гены?	https://www.bbc.co.uk/russian/vert-fut-42976511	www.bbc.co.uk
en_215.txt	BBC - Travel - In China, Chengdu’s peculiar ear-cleaning custom	http://www.bbc.com/travel/story/20181029-in-china-chengdus-peculiar-ear-cleaning-custom	20181029	30 October 2018	Странная традиция Чэнду: блаженные муки чистки ушей по-китайски	https://www.bbc.co.uk/russian/vert-tra-46056904	www.bbc.co.uk
en_216.txt	Is a low-salt diet as unhealthy as having too much? - BBC Future	http://www.bbc.com/future/story/20181029-eating-less-salt-benefits	20181029		Недосаливать так же вредно, как и пересаливать?	https://www.bbc.co.uk/russian/vert-fut-46056896	www.bbc.co.uk
en_217.txt	What it takes to stand up to authority - BBC Future	http://www.bbc.com/future/story/20180709-our-ability-to-stand-up-to-authority-comes-down-to-the-brain	20180709		Умение не поступаться принципами - можно ли этому научить?	https://www.bbc.co.uk/russian/vert-fut-45133400	www.bbc.co.uk
en_219.txt	How laughter makes you a better worker - BBC Worklife	http://www.bbc.com/capital/story/20180404-how-laughter-makes-you-a-better-worker	20180404		Смех на рабочем месте - признак… чего?	http://www.bbc.co.uk/russian/vert-cap-43656463	www.bbc.co.uk
en_220.txt	Why having white teeth doesn’t mean they are healthy - BBC Future	http://www.bbc.com/future/story/20171208-why-having-white-teeth-doesnt-mean-they-are-healthy	20171208		Почему белоснежная улыбка не означает, что у вас здоровые зубы	http://www.bbc.co.uk/russian/vert-fut-42325444	www.bbc.co.uk
en_221.txt	The age you feel means more than your actual birthdate - BBC Future	http://www.bbc.com/future/story/20180712-the-age-you-feel-means-more-than-your-actual-birthdate	20180712		На сколько лет вы себя чувствуете? От этого зависит ваше будущее	https://www.bbc.co.uk/russian/vert-fut-45033822	www.bbc.co.uk
en_222.txt	The space race like you’ve never seen it before - BBC Future	http://www.bbc.com/future/story/20181019-the-space-race-like-youve-never-seen-it-before	20181019		Гитарист Queen выпустил увлекательнейшую книгу. Но она не о музыке	https://www.bbc.co.uk/russian/vert-fut-45965813	www.bbc.co.uk
en_223.txt	How an ancient tradition shaped a nation's work ethic - BBC Worklife	http://www.bbc.com/capital/story/20180521-how-dugnad-shaped-a-nations-work-ethic	20180521		Почему норвежцам нравится работать бесплатно	http://www.bbc.co.uk/russian/vert-cap-44413726	www.bbc.co.uk
en_224.txt	BBC - Travel - The cities that make living easy	http://www.bbc.com/travel/story/20180909-five-cities-that-are-more-liveable-than-ever	20180909	10 September 2018	Пять городов, жить в которых год от года становится все комфортней	https://www.bbc.co.uk/russian/vert-tra-45509773	www.bbc.co.uk
en_225.txt	The World War Two guide to office warfare - BBC Worklife	http://www.bbc.com/capital/story/20171211-the-world-war-two-guide-to-office-warfare	20171211		Инструкция разведки США по организации диверсий в вашем офисе	http://www.bbc.co.uk/russian/vert-cap-42720875	www.bbc.co.uk
en_226.txt	The puzzling link between suicide and spring - BBC Future	http://www.bbc.com/future/story/20170317-the-puzzling-link-between-suicide-and-spring	20170317		Есть ли связь между весной и самоубийствами?	http://www.bbc.co.uk/russian/vert-fut-39407006	www.bbc.co.uk
en_227.txt	The complicated truth about a cat’s purr - BBC Future	http://www.bbc.com/future/story/20180724-the-complicated-truth-about-a-cats-purr	20180724		Почему нам важно знать всю правду о мурчании кошек	https://www.bbc.co.uk/russian/vert-fut-44971072	www.bbc.co.uk
en_228.txt	Five myths about loneliness - BBC Future	http://www.bbc.com/future/story/20180213-five-myths-about-loneliness	20180213		Пять мифов об одиночестве: неужели всё так плохо?	https://www.bbc.co.uk/russian/vert-fut-43142438	www.bbc.co.uk
en_229.txt	Why you eat more when you’re in company - BBC Future	http://www.bbc.com/future/story/20180430-why-you-eat-more-when-youre-in-company	20180430		Почему в компании мы съедаем больше? Ответ оказался не так прост	http://www.bbc.co.uk/russian/vert-fut-44170981	www.bbc.co.uk
en_230.txt	BBC - Culture - What that Trudeau-Trump handshake moment means	http://www.bbc.com/culture/story/20170217-what-that-trudeau-trump-handshake-moment-means	20170217	17 February 2017	Что произошло за секунду до рукопожатия Трюдо и Трампа	http://www.bbc.co.uk/russian/vert-cul-39028547	www.bbc.co.uk
en_231.txt	The Conversation: In-depth analysis, research, news and ideas from leading academics and researchers.	https://theconversation.com/uk	20170217		Можно ли уксусом лечить болезни? Вот научные факты	https://www.bbc.co.uk/russian/vert-fut-46142307	www.bbc.co.uk
